{
  "$id": "https://blueprint-conformance.github.io/bce/schemas/engineering-blueprint.schema.json",
  "$ref": "#/definitions/EngineeringBlueprint",
  "$schema": "http://json-schema.org/draft-07/schema#",
  "definitions": {
    "EngineeringBlueprint": {
      "additionalProperties": false,
      "properties": {
        "apiVersion": {
          "const": "blueprint-conformance/v1alpha1",
          "type": "string"
        },
        "approvals": {
          "items": {
            "additionalProperties": {},
            "properties": {
              "role": {
                "type": "string"
              },
              "stage": {
                "type": "string"
              }
            },
            "required": [
              "role",
              "stage"
            ],
            "type": "object"
          },
          "type": "array"
        },
        "architecture": {
          "additionalProperties": {},
          "properties": {
            "components": {
              "items": {
                "additionalProperties": {},
                "properties": {
                  "id": {
                    "type": "string"
                  },
                  "owner": {
                    "type": "string"
                  },
                  "type": {
                    "type": "string"
                  }
                },
                "required": [
                  "id",
                  "type"
                ],
                "type": "object"
              },
              "type": "array"
            },
            "relationships": {
              "items": {
                "additionalProperties": {},
                "properties": {
                  "allowed": {
                    "type": "boolean"
                  },
                  "from": {
                    "type": "string"
                  },
                  "to": {
                    "type": "string"
                  },
                  "type": {
                    "type": "string"
                  }
                },
                "required": [
                  "from",
                  "to",
                  "type",
                  "allowed"
                ],
                "type": "object"
              },
              "type": "array"
            }
          },
          "required": [
            "components",
            "relationships"
          ],
          "type": "object"
        },
        "constraints": {
          "items": {
            "additionalProperties": {},
            "properties": {
              "behaviorRef": {
                "type": "string"
              },
              "component": {
                "type": "string"
              },
              "egressCallees": {
                "items": {
                  "type": "string"
                },
                "type": "array"
              },
              "environmentId": {
                "minLength": 1,
                "type": "string"
              },
              "evidenceType": {
                "type": "string"
              },
              "expectedStackDigest": {
                "pattern": "^[0-9a-f]{64}$",
                "type": "string"
              },
              "expectedVersion": {
                "type": "string"
              },
              "forbiddenEgressHosts": {
                "items": {
                  "type": "string"
                },
                "type": "array"
              },
              "from": {
                "type": "string"
              },
              "governedHosts": {
                "items": {
                  "type": "string"
                },
                "type": "array"
              },
              "id": {
                "type": "string"
              },
              "metric": {
                "type": "string"
              },
              "minimum": {
                "type": "number"
              },
              "packageName": {
                "minLength": 1,
                "type": "string"
              },
              "path": {
                "type": "string"
              },
              "pattern": {
                "type": "string"
              },
              "policyRef": {
                "type": "string"
              },
              "probeDefinitionHash": {
                "pattern": "^[0-9a-f]{64}$",
                "type": "string"
              },
              "scopePaths": {
                "items": {
                  "type": "string"
                },
                "type": "array"
              },
              "severity": {
                "enum": [
                  "info",
                  "low",
                  "medium",
                  "high",
                  "critical"
                ],
                "type": "string"
              },
              "stackTarget": {
                "additionalProperties": false,
                "properties": {
                  "kind": {
                    "enum": [
                      "npm",
                      "oci-image",
                      "node-runtime"
                    ],
                    "type": "string"
                  },
                  "name": {
                    "minLength": 1,
                    "type": "string"
                  }
                },
                "required": [
                  "kind",
                  "name"
                ],
                "type": "object"
              },
              "stimulusSetHash": {
                "pattern": "^[0-9a-f]{64}$",
                "type": "string"
              },
              "to": {
                "type": "string"
              },
              "type": {
                "enum": [
                  "forbiddenDependency",
                  "requiredDependency",
                  "requiredComponent",
                  "forbiddenPath",
                  "forbiddenFile",
                  "forbiddenEgress",
                  "requiredEvidence",
                  "minimumMetric",
                  "customPolicy",
                  "behavioralInvariant",
                  "forbiddenPattern",
                  "pinnedVersion",
                  "stackClosureMatch",
                  "forbiddenStackPackage",
                  "requirePinnedImages",
                  "allowedNodeVersions"
                ],
                "type": "string"
              },
              "versions": {
                "items": {
                  "pattern": "^(0|[1-9]\\d*)\\.(0|[1-9]\\d*)\\.(0|[1-9]\\d*)(?:-(?:0|[1-9]\\d*|\\d*[A-Za-z-][0-9A-Za-z-]*)(?:\\.(?:0|[1-9]\\d*|\\d*[A-Za-z-][0-9A-Za-z-]*))*)?(?:\\+[0-9A-Za-z-]+(?:\\.[0-9A-Za-z-]+)*)?$",
                  "type": "string"
                },
                "minItems": 1,
                "type": "array"
              }
            },
            "required": [
              "id",
              "type",
              "severity"
            ],
            "type": "object"
          },
          "minItems": 1,
          "type": "array"
        },
        "evidenceRequirements": {
          "items": {
            "additionalProperties": {},
            "properties": {
              "freshnessSeconds": {
                "maximum": 9007199254740991,
                "minimum": -9007199254740991,
                "type": "integer"
              },
              "minimumCoverage": {
                "type": "number"
              },
              "onMissing": {
                "enum": [
                  "unknown",
                  "block",
                  "warn"
                ],
                "type": "string"
              },
              "producerPolicy": {
                "type": "string"
              },
              "required": {
                "type": "boolean"
              },
              "type": {
                "type": "string"
              }
            },
            "required": [
              "type",
              "required"
            ],
            "type": "object"
          },
          "type": "array"
        },
        "evolution": {
          "additionalProperties": {},
          "propertyNames": {
            "type": "string"
          },
          "type": "object"
        },
        "extraction": {
          "additionalProperties": false,
          "properties": {
            "forbiddenEgressHosts": {
              "items": {
                "type": "string"
              },
              "type": "array"
            },
            "forbiddenImports": {
              "items": {
                "type": "string"
              },
              "type": "array"
            },
            "governedModules": {
              "items": {
                "type": "string"
              },
              "type": "array"
            },
            "guardSymbols": {
              "items": {
                "type": "string"
              },
              "type": "array"
            },
            "minFiles": {
              "exclusiveMinimum": 0,
              "maximum": 9007199254740991,
              "type": "integer"
            },
            "paths": {
              "items": {
                "minLength": 1,
                "type": "string"
              },
              "type": "array"
            },
            "profile": {
              "enum": [
                "next-route-handler",
                "plugin-surface",
                "typescript-module-graph",
                "python-import-surface",
                "python-module-graph"
              ],
              "type": "string"
            },
            "pythonRoots": {
              "items": {
                "minLength": 1,
                "type": "string"
              },
              "type": "array"
            },
            "tsconfig": {
              "minLength": 1,
              "type": "string"
            }
          },
          "required": [
            "profile"
          ],
          "type": "object"
        },
        "intentRefs": {
          "items": {
            "type": "string"
          },
          "minItems": 1,
          "type": "array"
        },
        "kind": {
          "const": "EngineeringBlueprint",
          "type": "string"
        },
        "metadata": {
          "additionalProperties": {},
          "properties": {
            "id": {
              "minLength": 1,
              "type": "string"
            },
            "name": {
              "type": "string"
            },
            "ownerRole": {
              "type": "string"
            },
            "status": {
              "enum": [
                "draft",
                "proposed",
                "approved",
                "deprecated",
                "retired"
              ],
              "type": "string"
            },
            "stewardRole": {
              "type": "string"
            },
            "version": {
              "pattern": "^\\d+\\.\\d+\\.\\d+$",
              "type": "string"
            }
          },
          "required": [
            "id",
            "version",
            "status"
          ],
          "type": "object"
        },
        "minEngineVersion": {
          "pattern": "^\\d+\\.\\d+\\.\\d+$",
          "type": "string"
        },
        "scope": {
          "additionalProperties": {},
          "properties": {
            "environments": {
              "items": {
                "type": "string"
              },
              "type": "array"
            },
            "paths": {
              "items": {
                "minLength": 1,
                "type": "string"
              },
              "type": "array"
            },
            "repositories": {
              "items": {
                "type": "string"
              },
              "minItems": 1,
              "type": "array"
            }
          },
          "required": [
            "repositories"
          ],
          "type": "object"
        },
        "stack": {
          "additionalProperties": false,
          "properties": {
            "imageFiles": {
              "items": {
                "minLength": 1,
                "type": "string"
              },
              "type": "array"
            },
            "lockfile": {
              "enum": [
                "package-lock.json",
                "npm-shrinkwrap.json",
                "pnpm-lock.yaml"
              ],
              "type": "string"
            },
            "packageManifest": {
              "const": "package.json",
              "type": "string"
            },
            "runtimeFiles": {
              "items": {
                "minLength": 1,
                "type": "string"
              },
              "type": "array"
            },
            "source": {
              "enum": [
                "npm-lockfile-v3",
                "pnpm-lockfile-v9"
              ],
              "type": "string"
            }
          },
          "required": [
            "source",
            "lockfile",
            "packageManifest",
            "imageFiles",
            "runtimeFiles"
          ],
          "type": "object"
        }
      },
      "required": [
        "apiVersion",
        "kind",
        "metadata",
        "intentRefs",
        "scope",
        "architecture",
        "constraints",
        "evidenceRequirements",
        "approvals"
      ],
      "type": "object"
    }
  },
  "description": "The authored per-repository blueprint artifact (apiVersion blueprint-conformance/v1alpha1). Mechanically derived from the normative Zod schema in src/schema.ts. STRUCTURAL floor only: Zod refinements (e.g. forbiddenPattern regex safety and the TypeScript module profile's engine-floor/selector contract) are enforced by the engine but not expressible here — where the two diverge, the engine schema is normative (spec/SPEC.md).",
  "title": "EngineeringBlueprint"
}
