{
  "apiVersion": "blueprint-conformance/v1alpha1",
  "kind": "EngineeringBlueprint",
  "metadata": {
    "id": "provider-refactor",
    "version": "1.0.0",
    "status": "approved"
  },
  "intentRefs": [
    "pilot-policy/provider-refactor"
  ],
  "scope": {
    "repositories": [
      "pilot/provider-lab"
    ]
  },
  "architecture": {
    "components": [],
    "relationships": []
  },
  "constraints": [
    {
      "id": "provider-refactor-no-forbidden-edge",
      "type": "forbiddenDependency",
      "severity": "critical",
      "from": "*",
      "to": "module:src/vendor/raw-provider.mjs",
      "scopePaths": [
        "src/features/message-vector.mjs"
      ]
    }
  ],
  "evidenceRequirements": [],
  "approvals": [],
  "minEngineVersion": "0.3.0",
  "extraction": {
    "profile": "typescript-module-graph",
    "paths": [
      "src/**/*.mjs"
    ],
    "minFiles": 5
  }
}
