{
  "apiVersion": "blueprint-conformance/v1alpha1",
  "kind": "EngineeringBlueprint",
  "metadata": {
    "id": "boundary-repair",
    "version": "1.0.0",
    "status": "approved"
  },
  "intentRefs": [
    "pilot-policy/boundary-repair"
  ],
  "scope": {
    "repositories": [
      "pilot/boundary-microcosm"
    ]
  },
  "architecture": {
    "components": [],
    "relationships": []
  },
  "constraints": [
    {
      "id": "service-no-direct-provider-sdk",
      "type": "forbiddenPattern",
      "severity": "critical",
      "path": "src/service.mjs",
      "pattern": "provider-sdk"
    }
  ],
  "evidenceRequirements": [],
  "approvals": [],
  "extraction": {
    "profile": "plugin-surface",
    "paths": [
      "src/**/*.mjs"
    ],
    "minFiles": 4
  }
}
