{
  "apiVersion": "blueprint-conformance/v1alpha1",
  "kind": "EngineeringBlueprint",
  "metadata": {
    "id": "tenant-refactor",
    "version": "1.0.0",
    "status": "approved"
  },
  "intentRefs": [
    "pilot-policy/tenant-refactor"
  ],
  "scope": {
    "repositories": [
      "pilot/tenant-lab"
    ]
  },
  "architecture": {
    "components": [],
    "relationships": []
  },
  "constraints": [
    {
      "id": "tenant-refactor-requires-governed-edge",
      "type": "requiredDependency",
      "severity": "critical",
      "component": "typescriptModule",
      "to": "module:src/security/tenant-access.mjs",
      "scopePaths": [
        "src/routes/secret-owner.mjs"
      ]
    }
  ],
  "evidenceRequirements": [],
  "approvals": [],
  "minEngineVersion": "0.3.0",
  "extraction": {
    "profile": "typescript-module-graph",
    "paths": [
      "src/**/*.mjs"
    ],
    "minFiles": 5
  }
}
