{
  "apiVersion": "blueprint-conformance/v1alpha1",
  "kind": "EngineeringBlueprint",
  "metadata": {
    "id": "workspace-access-repair",
    "version": "1.0.0",
    "status": "approved"
  },
  "intentRefs": [
    "pilot-policy/workspace-access-repair"
  ],
  "scope": {
    "repositories": [
      "pilot/workspace-access-lab"
    ]
  },
  "architecture": {
    "components": [],
    "relationships": []
  },
  "constraints": [
    {
      "id": "workspace-access-repair-requires-governed-edge",
      "type": "requiredDependency",
      "severity": "critical",
      "component": "typescriptModule",
      "to": "module:src/security/workspace-access.mjs",
      "scopePaths": [
        "src/routes/repair-report.mjs"
      ]
    }
  ],
  "evidenceRequirements": [],
  "approvals": [],
  "minEngineVersion": "0.3.0",
  "extraction": {
    "profile": "typescript-module-graph",
    "paths": [
      "src/**/*.mjs"
    ],
    "minFiles": 5
  }
}
