{
  "apiVersion": "blueprint-conformance/v1alpha1",
  "kind": "EngineeringBlueprint",
  "metadata": {
    "id": "runtime-repair",
    "version": "1.0.0",
    "status": "approved"
  },
  "intentRefs": [
    "pilot-policy/runtime-repair"
  ],
  "scope": {
    "repositories": [
      "pilot/runtime-lab"
    ]
  },
  "architecture": {
    "components": [],
    "relationships": []
  },
  "constraints": [
    {
      "id": "runtime-repair-no-forbidden-edge",
      "type": "forbiddenDependency",
      "severity": "critical",
      "from": "*",
      "to": "builtin:path",
      "scopePaths": [
        "src/browser/repair-route.mjs"
      ]
    }
  ],
  "evidenceRequirements": [],
  "approvals": [],
  "minEngineVersion": "0.3.0",
  "extraction": {
    "profile": "typescript-module-graph",
    "paths": [
      "src/**/*.mjs"
    ],
    "minFiles": 5
  }
}
